{"$schema":"https://json-schema.org/draft/2020-12/schema","$id":"https://cps.local/schemas/compile_report_1_1_5d.schema.json","title":"GEN0-B CompileReport 1.1 (five-dimensional authority)","type":"object","additionalProperties":false,"required":["schema","schema_version","source_program_hash","compiler_manifest_hash","compiler_build_id","budget_profile_digest","status","project_hash","evidence_hash","receipt","search_statistics","error"],"properties":{"schema":{"const":"cps.compile-report"},"schema_version":{"const":"1.1.0"},"source_program_hash":{"$ref":"#/$defs/sha256"},"compiler_manifest_hash":{"$ref":"#/$defs/sha256"},"compiler_build_id":{"type":"string"},"budget_profile_digest":{"$ref":"#/$defs/sha256"},"status":{"enum":["success","failure"]},"project_hash":{"oneOf":[{"$ref":"#/$defs/sha256"},{"type":"null"}]},"evidence_hash":{"oneOf":[{"$ref":"#/$defs/sha256"},{"type":"null"}]},"receipt":{"$ref":"charge_receipt_1_1_5d.schema.json"},"search_statistics":{"type":"object","additionalProperties":false,"required":["chord_query_count","chord_candidates_examined","chord_eligible_candidates","progression_query_count","progression_states","progression_edges"],"properties":{"chord_query_count":{"type":"integer","minimum":0},"chord_candidates_examined":{"type":"integer","minimum":0},"chord_eligible_candidates":{"type":"integer","minimum":0},"progression_query_count":{"type":"integer","minimum":0},"progression_states":{"type":"integer","minimum":0},"progression_edges":{"type":"integer","minimum":0}}},"error":{"oneOf":[{"type":"null"},{"$ref":"#/$defs/error"}]}},"$defs":{"sha256":{"type":"string","pattern":"^sha256:[0-9a-f]{64}$"},"error":{"type":"object","additionalProperties":false,"required":["code","stage","pointer","counter","requested","used","ceiling","child_query_id","snapshot","partial_project"],"properties":{"code":{"type":"string","pattern":"^[A-Z][A-Z0-9_]{2,95}$"},"stage":{"type":"string"},"pointer":{"type":"string"},"counter":{"type":["string","null"],"enum":[null,"structural_items","placed_domain_points","exact_arithmetic_units","numeric_eval_units","chord_search_nodes","pair_relations","ordering_units","validation_items","emitted_events","progression_states","progression_edges","total_logical_units"]},"requested":{"type":["integer","null"],"minimum":0},"used":{"type":["integer","null"],"minimum":0},"ceiling":{"type":["integer","null"],"minimum":0},"child_query_id":{"type":["string","null"]},"snapshot":{"type":"object","additionalProperties":{"type":"integer","minimum":0}},"partial_project":{"type":"null"}}}}}
