{"budget_profile_digest":"sha256:6f8a51462cac19bc99104faa8c4d2173f177891ed64e5381f3e08411e5e45c0e","compiler_build_id":"cb_5omao4cu5umz62dzd6s23yxhma","compiler_manifest_hash":"sha256:0a4de049e13cfabcab4b55e779259e6c9fe9223fb2123dea990ee94ae507ee95","error":null,"evidence_hash":"sha256:777ad1b1046593a92d5f3ba8e0d526f42d7395c5e5952bd2fc94267022e04103","project_hash":"sha256:76f257a4053de35ad05f40a937d99721b1de1a238e6f68f4f5b73372df8df8da","receipt":{"budget_profile_digest":"sha256:6f8a51462cac19bc99104faa8c4d2173f177891ed64e5381f3e08411e5e45c0e","budget_profile_id":"gen0-progression-exact-v1","children":[{"input_hash":"sha256:bab070f670c23ce142af866c4cf1d53e7221b497d2f529b41e5389e0f53b3871","kind":"chord_query","opcode_stream_hash":"sha256:91f578b697223ba8423406b4c3d4ef62ff803b4fceb7c107d9a6eef2019c85e9","query_id":"chord_bab070f670c23ce1","status":"complete","usage":{"chord_search_nodes":313,"exact_arithmetic_units":4675,"numeric_eval_units":1779,"ordering_units":10,"pair_relations":101,"total_logical_units":6878}},{"input_hash":"sha256:cdc832318bf3b857dc98f2ec8992c142e81337bfa6c8066314f9b17c955b0705","kind":"progression_query","opcode_stream_hash":"sha256:4f01ad2f16d4d479be1bc9329d920d96626dedce67da8e897358f1042cc96e7e","query_id":"progression_cdc832318bf3b857","status":"complete","usage":{"progression_edges":2,"progression_states":3,"total_logical_units":5}}],"input_hash":"sha256:c35cefdfeeb812eceed4c07e619d4f0197a3931c04f39a1625225dab4568c5b7","opcode_stream_hash":"sha256:a65f5fd9de9d549ea21efc1ff7e8879e8dba0e94d3edb978606df102c582739e","schema":"cps.charge-receipt","schema_version":"1.1.0","status":"complete","usage":{"chord_search_nodes":313,"emitted_events":12,"exact_arithmetic_units":16028,"numeric_eval_units":3459,"ordering_units":76,"pair_relations":101,"placed_domain_points":125,"progression_edges":2,"progression_states":3,"structural_items":242,"total_logical_units":20545,"validation_items":184}},"schema":"cps.compile-report","schema_version":"1.1.0","search_statistics":{"chord_candidates_examined":208,"chord_eligible_candidates":4,"chord_query_count":1,"progression_edges":2,"progression_query_count":1,"progression_states":3},"source_program_hash":"sha256:c2485608626f7264c8b145df91a6f27de02241196f4d24caa1f34dbd4fd9f7f3","status":"success"}
